{
  "schema_version": "1.2",
  "snap_name": "nginx",
  "confinement": "strict",
  "clean": true,
  "denials": [],
  "diagnostics": [],
  "oci_mode": true,
  "devmode_pass": true,
  "devmode_notes": [],
  "target_arch": "amd64",
  "test_environment_used": "native-lxd",
  "store_review_interfaces": ["system-files"],
  "reproducibility": {
    "checked": true,
    "diffs": [
      { "path": "etc/nginx/nginx.conf", "kind": "modified", "detail": "listen port rewritten" }
    ],
    "clean": false
  },
  "config_check": {
    "checked": true,
    "key": "port",
    "value": "8080",
    "value_changed": false,
    "set_ok": true,
    "daemons_active": true,
    "notes": ["Re-applied the current value; no enum option to change."]
  }
}
