{
  "schema_version": "1.2",
  "snap_name": "hello-cli",
  "confinement": "strict",
  "clean": true,
  "denials": [],
  "diagnostics": [],
  "oci_mode": false,
  "devmode_pass": null,
  "devmode_notes": [],
  "target_arch": null,
  "test_environment_used": null,
  "store_review_interfaces": [],
  "reproducibility": null,
  "config_check": null
}
